{
  "candidate_count": 44,
  "candidates": [
    {
      "candidate_id": "G2CAND-NOR-DOMSTOL-AR-2025",
      "edition_id": "ED-NOR-DOMSTOL-AR-2025",
      "edition_title": "Årsrapport 2025",
      "frame_rank": 1,
      "frame_score": "09cefac177e6994353c2dae094e4d5a2d99eee079f22c514a5c92af08121d15e",
      "jurisdiction_id": "NOR",
      "landing_page_url": "https://www.domstol.no/no/domstoladministrasjonen/publikasjoner/arsmeldingar/",
      "languages": [
        "no"
      ],
      "metadata_provenance_urls": [
        "https://www.domstol.no/no/domstoladministrasjonen/publikasjoner/arsmeldingar/"
      ],
      "prior_metadata_eligibility": "uncertain",
      "privacy_screen": "uncertain",
      "prohibited_data_screen": "uncertain",
      "proposed_stratum": "non_english_text_native",
      "publisher": "www.domstol.no",
      "retrieval_entrypoint": "https://www.domstol.no/no/domstoladministrasjonen/publikasjoner/arsmeldingar/",
      "retrieval_entrypoint_kind": "official_landing_page_requires_resolution",
      "rights_screen": "uncertain",
      "security_screen": "no_known_metadata_blocker",
      "source_access_authorized": false,
      "source_content_accessed": false,
      "source_series_id": "Domstoladministrasjonen — annual reports",
      "source_url": null
    },
    {
      "candidate_id": "G2CAND-PER-PJ-LALIBERTAD-BULLETIN-01-2024",
      "edition_id": "ED-PER-PJ-LALIBERTAD-BULLETIN-01-2024",
      "edition_title": "Boletín Estadístico Institucional N° 01-2024 — Corte Superior de Justicia de La Libertad",
      "frame_rank": 2,
      "frame_score": "0ff340bdcaa04243d06fd118d752fb0275dd781678ed3da1363a0b400219129c",
      "jurisdiction_id": "PER",
      "landing_page_url": "https://www.pj.gob.pe/wps/wcm/connect/Corte Superior La Libertad PJ/s_csj_LaLibertad_nuevo/as_corte_superior_LaLibertad/as_presidencia/as_documentos/as_resoluciones_administrativas/as_2024/?WCM_PI=1&WCM_Page.dcd566804ddc2df4838cdbcdee6548b3=47",
      "languages": [
        "es"
      ],
      "metadata_provenance_urls": [
        "https://www.pj.gob.pe/wps/wcm/connect/Corte Superior La Libertad PJ/s_csj_LaLibertad_nuevo/as_corte_superior_LaLibertad/as_presidencia/as_documentos/as_resoluciones_administrativas/as_2024/?WCM_PI=1&WCM_Page.dcd566804ddc2df4838cdbcdee6548b3=47"
      ],
      "prior_metadata_eligibility": "uncertain",
      "privacy_screen": "no_known_metadata_blocker",
      "prohibited_data_screen": "no_known_metadata_blocker",
      "proposed_stratum": "structurally_complex_mixed_layout_pdf",
      "publisher": "www.pj.gob.pe",
      "retrieval_entrypoint": "https://www.pj.gob.pe/wps/wcm/connect/Corte Superior La Libertad PJ/s_csj_LaLibertad_nuevo/as_corte_superior_LaLibertad/as_presidencia/as_documentos/as_resoluciones_administrativas/as_2024/?WCM_PI=1&WCM_Page.dcd566804ddc2df4838cdbcdee6548b3=47",
      "retrieval_entrypoint_kind": "official_landing_page_requires_resolution",
      "rights_screen": "uncertain",
      "security_screen": "no_known_metadata_blocker",
      "source_access_authorized": false,
      "source_content_accessed": false,
      "source_series_id": "Poder Judicial del Perú, CSJ La Libertad — institutional statistical bulletins",
      "source_url": null
    },
    {
      "candidate_id": "G2CAND-GBR-EAW-CAFCASS-ARA-2024-25",
      "edition_id": "ED-GBR-EAW-CAFCASS-ARA-2024-25",
      "edition_title": "Cafcass annual report and accounts 2024 to 2025",
      "frame_rank": 3,
      "frame_score": "1090c66effcc2e7b87e2cb0b190eb372049cb767f6346d093fdda5dcfe44e7c9",
      "jurisdiction_id": "GBR-EAW",
      "landing_page_url": "https://www.gov.uk/government/publications/cafcass-annual-report-and-accounts-2024-to-2025",
      "languages": [
        "en"
      ],
      "metadata_provenance_urls": [
        "https://www.gov.uk/government/publications/cafcass-annual-report-and-accounts-2024-to-2025"
      ],
      "prior_metadata_eligibility": "eligible_metadata_only",
      "privacy_screen": "no_known_metadata_blocker",
      "prohibited_data_screen": "no_known_metadata_blocker",
      "proposed_stratum": "structurally_complex_mixed_layout_pdf",
      "publisher": "www.gov.uk",
      "retrieval_entrypoint": "https://www.gov.uk/government/publications/cafcass-annual-report-and-accounts-2024-to-2025",
      "retrieval_entrypoint_kind": "official_landing_page_requires_resolution",
      "rights_screen": "no_known_metadata_blocker",
      "security_screen": "no_known_metadata_blocker",
      "source_access_authorized": false,
      "source_content_accessed": false,
      "source_series_id": "GBR-EAW-CAFCASS-ANNUAL-REPORT-ACCOUNTS",
      "source_url": null
    },
    {
      "candidate_id": "G2CAND-AUS-VIC-MCV-AR-2024-25",
      "edition_id": "ED-AUS-VIC-MCV-AR-2024-25",
      "edition_title": "MCV Annual Report 2024-2025",
      "frame_rank": 4,
      "frame_score": "19b4dc254a5572cbeaf078e3c8fa15052e96e99cabbecae95f7fd11343b7d78e",
      "jurisdiction_id": "AUS-VIC",
      "landing_page_url": "https://www.mcv.vic.gov.au/news-and-resources/publications/annual-report-2024-2025",
      "languages": [
        "en"
      ],
      "metadata_provenance_urls": [
        "https://www.mcv.vic.gov.au/news-and-resources/publications/annual-report-2024-2025"
      ],
      "prior_metadata_eligibility": "uncertain",
      "privacy_screen": "no_known_metadata_blocker",
      "prohibited_data_screen": "no_known_metadata_blocker",
      "proposed_stratum": null,
      "publisher": "www.mcv.vic.gov.au",
      "retrieval_entrypoint": "https://www.mcv.vic.gov.au/news-and-resources/publications/annual-report-2024-2025",
      "retrieval_entrypoint_kind": "official_landing_page_requires_resolution",
      "rights_screen": "uncertain",
      "security_screen": "no_known_metadata_blocker",
      "source_access_authorized": false,
      "source_content_accessed": false,
      "source_series_id": "AUS-VIC-MAGISTRATES-COURT-ANNUAL-REPORT",
      "source_url": null
    },
    {
      "candidate_id": "G2CAND-GBR-NIR-NICTS-INFOGRAPHIC-2023",
      "edition_id": "ED-GBR-NIR-NICTS-INFOGRAPHIC-2023",
      "edition_title": "Judicial Statistics 2023 - Infographic",
      "frame_rank": 5,
      "frame_score": "223244febf916640b292b42ebea6eddd9d3e7bac6980e5a138b3708274aef594",
      "jurisdiction_id": "GBR-NIR",
      "landing_page_url": "https://www.justice-ni.gov.uk/publications/nicts-judicial-statistics",
      "languages": [
        "en"
      ],
      "metadata_provenance_urls": [
        "https://www.justice-ni.gov.uk/publications/nicts-judicial-statistics"
      ],
      "prior_metadata_eligibility": "uncertain",
      "privacy_screen": "no_known_metadata_blocker",
      "prohibited_data_screen": "no_known_metadata_blocker",
      "proposed_stratum": "embedded_raster_or_dashboard_pdf",
      "publisher": "www.justice-ni.gov.uk",
      "retrieval_entrypoint": "https://www.justice-ni.gov.uk/publications/nicts-judicial-statistics",
      "retrieval_entrypoint_kind": "official_landing_page_requires_resolution",
      "rights_screen": "uncertain",
      "security_screen": "no_known_metadata_blocker",
      "source_access_authorized": false,
      "source_content_accessed": false,
      "source_series_id": "GBR-NIR-NICTS-JUDICIAL-STATISTICS-INFOGRAPHIC",
      "source_url": null
    },
    {
      "candidate_id": "G2CAND-AUS-NSW-LOCAL-AR-2024",
      "edition_id": "ED-AUS-NSW-LOCAL-AR-2024",
      "edition_title": "2024 Annual Review",
      "frame_rank": 6,
      "frame_score": "242f8097895f631248756ecefeb42e8e64b0299d0d176d42e74259f0b6e91902",
      "jurisdiction_id": "AUS-NSW",
      "landing_page_url": "https://localcourt.nsw.gov.au/practice-publications/publications/annual-reviews.html",
      "languages": [
        "en"
      ],
      "metadata_provenance_urls": [
        "https://localcourt.nsw.gov.au/practice-publications/publications/annual-reviews.html"
      ],
      "prior_metadata_eligibility": "uncertain",
      "privacy_screen": "uncertain",
      "prohibited_data_screen": "uncertain",
      "proposed_stratum": null,
      "publisher": "localcourt.nsw.gov.au",
      "retrieval_entrypoint": "https://localcourt.nsw.gov.au/practice-publications/publications/annual-reviews.html",
      "retrieval_entrypoint_kind": "official_landing_page_requires_resolution",
      "rights_screen": "uncertain",
      "security_screen": "no_known_metadata_blocker",
      "source_access_authorized": false,
      "source_content_accessed": false,
      "source_series_id": "AUS-NSW-LOCAL-COURT-ANNUAL-REVIEW",
      "source_url": null
    },
    {
      "candidate_id": "G2CAND-DNK-COURTS-NATIONAL-AR-2024",
      "edition_id": "ED-DNK-COURTS-NATIONAL-AR-2024",
      "edition_title": "Danmarks Domstoles Årsrapport 2024",
      "frame_rank": 7,
      "frame_score": "2b3943fa135af9b6e090aed511871e34c9ed9c4ec02bed55a17ea6348381e724",
      "jurisdiction_id": "DNK",
      "landing_page_url": "https://www.domstol.dk/om-os/aarsrapporter/",
      "languages": [
        "da"
      ],
      "metadata_provenance_urls": [
        "https://www.domstol.dk/om-os/aarsrapporter/"
      ],
      "prior_metadata_eligibility": "uncertain",
      "privacy_screen": "uncertain",
      "prohibited_data_screen": "uncertain",
      "proposed_stratum": "structurally_complex_mixed_layout_pdf",
      "publisher": "www.domstol.dk",
      "retrieval_entrypoint": "https://www.domstol.dk/om-os/aarsrapporter/",
      "retrieval_entrypoint_kind": "official_landing_page_requires_resolution",
      "rights_screen": "uncertain",
      "security_screen": "no_known_metadata_blocker",
      "source_access_authorized": false,
      "source_content_accessed": false,
      "source_series_id": "Danmarks Domstole — national annual reports",
      "source_url": null
    },
    {
      "candidate_id": "G2CAND-NLD-RECHTSPRAAK-OVERIJSSEL-AR-2024",
      "edition_id": "ED-NLD-RECHTSPRAAK-OVERIJSSEL-AR-2024",
      "edition_title": "Jaarverslag 2024 rechtbank Overijssel",